[
  {
    "id": "ab-cann-llc-west-babylon",
    "licenseNumber": "OCM-RETL-24-000001",
    "applicationNumber": "OCMRETL-2023-001580",
    "licenseType": "ADULT_USE_RETAIL_DISPENSARY",
    "licenseStatus": "ACTIVE",
    "operationalStatus": "UNKNOWN",
    "seeCategory": null,
    "legalName": "AB CANN LLC",
    "dbaName": null,
    "address": {
      "line1": "111 Cabot St",
      "line2": null,
      "city": "West Babylon",
      "county": "Suffolk",
      "borough": null,
      "neighborhood": null,
      "state": "NY",
      "zip": "11704"
    },
    "geo": null,
    "contact": {
      "phone": null,
      "email": null,
      "website": null,
      "orderOnlineUrl": null,
      "instagram": null
    },
    "hours": null,
    "services": null,
    "menu": null,
    "dates": {
      "licenseIssued": "2024-02-22",
      "licenseEffective": "2026-02-23",
      "licenseExpiration": "2028-02-22",
      "openedOn": null
    },
    "sources": [
      {
        "url": "https://data.ny.gov/resource/jskf-tt3q.json",
        "label": "NYS Office of Cannabis Management — Current OCM Licenses",
        "type": "OFFICIAL_REGISTRY",
        "retrievedAt": "2026-09-20T15:03:15.751Z"
      }
    ],
    "verification": {
      "status": "VERIFIED_OFFICIAL",
      "confidence": "LOW",
      "verifiedAt": "2026-09-20T15:03:15.751Z",
      "checkedAgainstOcmTool": null,
      "notes": "Imported from the state registry. Contact details, hours and services are not yet enriched."
    },
    "warnings": [],
    "lastUpdated": "2026-09-20T15:03:15.751Z"
  },
  {
    "id": "aromatic-gardens-west-babylon",
    "licenseNumber": "OCM-CAURD-25-000260",
    "applicationNumber": "OCMCAURDP-2024-000135",
    "licenseType": "ADULT_USE_RETAIL_DISPENSARY",
    "licenseStatus": "ACTIVE",
    "operationalStatus": "UNKNOWN",
    "seeCategory": null,
    "legalName": "Empire Genetics New York Inc.",
    "dbaName": "Aromatic Gardens",
    "address": {
      "line1": "231 Edison Ave",
      "line2": null,
      "city": "West Babylon",
      "county": "Suffolk",
      "borough": null,
      "neighborhood": null,
      "state": "NY",
      "zip": "11704"
    },
    "geo": null,
    "contact": {
      "phone": null,
      "email": null,
      "website": null,
      "orderOnlineUrl": null,
      "instagram": null
    },
    "hours": null,
    "services": null,
    "menu": null,
    "dates": {
      "licenseIssued": "2025-03-28",
      "licenseEffective": "2025-03-28",
      "licenseExpiration": "2027-03-28",
      "openedOn": null
    },
    "sources": [
      {
        "url": "https://data.ny.gov/resource/jskf-tt3q.json",
        "label": "NYS Office of Cannabis Management — Current OCM Licenses",
        "type": "OFFICIAL_REGISTRY",
        "retrievedAt": "2026-09-20T15:03:15.751Z"
      }
    ],
    "verification": {
      "status": "VERIFIED_OFFICIAL",
      "confidence": "LOW",
      "verifiedAt": "2026-09-20T15:03:15.751Z",
      "checkedAgainstOcmTool": null,
      "notes": "Imported from the state registry. Contact details, hours and services are not yet enriched."
    },
    "warnings": [],
    "lastUpdated": "2026-09-20T15:03:15.751Z"
  },
  {
    "id": "beleaf-calverton-calverton",
    "licenseNumber": "OCM-CAURD-24-000216",
    "applicationNumber": "OCMCAURDP-2024-000015",
    "licenseType": "ADULT_USE_RETAIL_DISPENSARY",
    "licenseStatus": "ACTIVE",
    "operationalStatus": "UNKNOWN",
    "seeCategory": null,
    "legalName": "Beyond Beleaf NY INC",
    "dbaName": "Beleaf Calverton",
    "address": {
      "line1": "4462 Middle Country Rd",
      "line2": null,
      "city": "Calverton",
      "county": "Suffolk",
      "borough": null,
      "neighborhood": null,
      "state": "NY",
      "zip": "11933"
    },
    "geo": null,
    "contact": {
      "phone": null,
      "email": null,
      "website": null,
      "orderOnlineUrl": null,
      "instagram": null
    },
    "hours": null,
    "services": null,
    "menu": null,
    "dates": {
      "licenseIssued": "2024-11-08",
      "licenseEffective": "2024-11-08",
      "licenseExpiration": "2026-11-08",
      "openedOn": "2024-11-23"
    },
    "sources": [
      {
        "url": "https://data.ny.gov/resource/jskf-tt3q.json",
        "label": "NYS Office of Cannabis Management — Current OCM Licenses",
        "type": "OFFICIAL_REGISTRY",
        "retrievedAt": "2026-09-20T15:03:15.751Z"
      }
    ],
    "verification": {
      "status": "VERIFIED_OFFICIAL",
      "confidence": "LOW",
      "verifiedAt": "2026-09-20T15:03:15.751Z",
      "checkedAgainstOcmTool": null,
      "notes": "Imported from the state registry. Contact details, hours and services are not yet enriched."
    },
    "warnings": [],
    "lastUpdated": "2026-09-20T15:03:15.751Z"
  },
  {
    "id": "big-apple-bud-co-farmingdale",
    "licenseNumber": "OCM-CAURD-24-000168",
    "applicationNumber": "OCMCAURDP-2023-000174",
    "licenseType": "ADULT_USE_RETAIL_DISPENSARY",
    "licenseStatus": "ACTIVE",
    "operationalStatus": "UNKNOWN",
    "seeCategory": null,
    "legalName": "NYCC 1 LLC",
    "dbaName": "Big Apple Bud Co.",
    "address": {
      "line1": "228 Route 109",
      "line2": null,
      "city": "Farmingdale",
      "county": "Suffolk",
      "borough": null,
      "neighborhood": null,
      "state": "NY",
      "zip": "11735"
    },
    "geo": null,
    "contact": {
      "phone": null,
      "email": null,
      "website": null,
      "orderOnlineUrl": null,
      "instagram": null
    },
    "hours": null,
    "services": null,
    "menu": null,
    "dates": {
      "licenseIssued": "2024-07-12",
      "licenseEffective": "2024-07-12",
      "licenseExpiration": "2026-07-12",
      "openedOn": null
    },
    "sources": [
      {
        "url": "https://data.ny.gov/resource/jskf-tt3q.json",
        "label": "NYS Office of Cannabis Management — Current OCM Licenses",
        "type": "OFFICIAL_REGISTRY",
        "retrievedAt": "2026-09-20T15:03:15.751Z"
      }
    ],
    "verification": {
      "status": "VERIFIED_OFFICIAL",
      "confidence": "LOW",
      "verifiedAt": "2026-09-20T15:03:15.751Z",
      "checkedAgainstOcmTool": null,
      "notes": "Imported from the state registry. Contact details, hours and services are not yet enriched."
    },
    "warnings": [],
    "lastUpdated": "2026-09-20T15:03:15.751Z"
  },
  {
    "id": "big-jule-s-dispensary-inc-deer-park",
    "licenseNumber": "OCM-CAURD-25-000264",
    "applicationNumber": "OCMCAURDP-2025-000010",
    "licenseType": "ADULT_USE_RETAIL_DISPENSARY",
    "licenseStatus": "ACTIVE",
    "operationalStatus": "UNKNOWN",
    "seeCategory": null,
    "legalName": "Big Jule's Dispensary Inc.",
    "dbaName": null,
    "address": {
      "line1": "1070 Long Island Ave",
      "line2": null,
      "city": "Deer Park",
      "county": "Suffolk",
      "borough": null,
      "neighborhood": null,
      "state": "NY",
      "zip": "11729"
    },
    "geo": null,
    "contact": {
      "phone": null,
      "email": null,
      "website": null,
      "orderOnlineUrl": null,
      "instagram": null
    },
    "hours": null,
    "services": null,
    "menu": null,
    "dates": {
      "licenseIssued": "2025-04-11",
      "licenseEffective": "2025-04-11",
      "licenseExpiration": "2027-04-11",
      "openedOn": null
    },
    "sources": [
      {
        "url": "https://data.ny.gov/resource/jskf-tt3q.json",
        "label": "NYS Office of Cannabis Management — Current OCM Licenses",
        "type": "OFFICIAL_REGISTRY",
        "retrievedAt": "2026-09-20T15:03:15.751Z"
      }
    ],
    "verification": {
      "status": "VERIFIED_OFFICIAL",
      "confidence": "LOW",
      "verifiedAt": "2026-09-20T15:03:15.751Z",
      "checkedAgainstOcmTool": null,
      "notes": "Imported from the state registry. Contact details, hours and services are not yet enriched."
    },
    "warnings": [],
    "lastUpdated": "2026-09-20T15:03:15.751Z"
  },
  {
    "id": "brown-budda-new-york-southampton",
    "licenseNumber": "OCM-CAURD-24-000157",
    "applicationNumber": "OCMCAURDP-2023-000094",
    "licenseType": "ADULT_USE_RETAIL_DISPENSARY",
    "licenseStatus": "ACTIVE",
    "operationalStatus": "UNKNOWN",
    "seeCategory": null,
    "legalName": "Brown Budda New York LLC",
    "dbaName": "Brown Budda New York",
    "address": {
      "line1": "1533 County Road 39",
      "line2": null,
      "city": "Southampton",
      "county": "Suffolk",
      "borough": null,
      "neighborhood": null,
      "state": "NY",
      "zip": "11968"
    },
    "geo": null,
    "contact": {
      "phone": null,
      "email": null,
      "website": "https://www.brownbuddanewyork.co/",
      "orderOnlineUrl": null,
      "instagram": null
    },
    "hours": null,
    "services": null,
    "menu": null,
    "dates": {
      "licenseIssued": "2024-06-14",
      "licenseEffective": "2026-06-15",
      "licenseExpiration": "2028-06-14",
      "openedOn": "2024-11-12"
    },
    "sources": [
      {
        "url": "https://data.ny.gov/resource/jskf-tt3q.json",
        "label": "NYS Office of Cannabis Management — Current OCM Licenses",
        "type": "OFFICIAL_REGISTRY",
        "retrievedAt": "2026-09-20T15:03:15.751Z"
      }
    ],
    "verification": {
      "status": "VERIFIED_OFFICIAL",
      "confidence": "LOW",
      "verifiedAt": "2026-09-20T15:03:15.751Z",
      "checkedAgainstOcmTool": null,
      "notes": "Imported from the state registry. Contact details, hours and services are not yet enriched."
    },
    "warnings": [],
    "lastUpdated": "2026-09-20T15:03:15.751Z"
  },
  {
    "id": "budhampton-llc-bridgehampton",
    "licenseNumber": "OCM-RETL-24-000258",
    "applicationNumber": "OCMRETL-2023-001200",
    "licenseType": "ADULT_USE_RETAIL_DISPENSARY",
    "licenseStatus": "ACTIVE",
    "operationalStatus": "UNKNOWN",
    "seeCategory": null,
    "legalName": "Budhampton LLC",
    "dbaName": null,
    "address": {
      "line1": "2033 Montauk Hwy",
      "line2": null,